[
  {
    "prompt": "Summarize the following paragraph in two sentences: Artificial intelligence is a field that has seen rapid growth in the past decade. With the advent of deep learning, machines can now perform tasks such as image recognition, language translation, and even creative writing.",
    "completion": "Artificial intelligence has experienced a significant boom in recent years thanks to advancements in deep learning. Now, machines are capable of performing complex tasks like recognizing images, translating languages, and even generating creative content.",
    "tokens_prompt": 58,
    "tokens_completion": 40,
    "duration_s": 0.942,
    "response_time_s": 0.942,
    "energy_wh_raw": 0.003974,
    "energy_wh_net": 0.003974,
    "provider": "ollama",
    "model": "gemma3:1b",
    "region": "unknown",
    "notice": null,
    "sampling_ms": 100,
    "device_name": "Apple M1 Pro Mac (MacBookPro18,3)",
    "device_type": "apple",
    "os_name": "macOS",
    "os_version": "26.2",
    "cpu_model": "Apple M1 Pro",
    "gpu_model": "Apple M1 Pro",
    "ram_gb": 16.0,
    "chip_architecture": "arm64",
    "testset_id": "ts4",
    "testset_name": "Mixed task suite (realistic workload)",
    "testset_goal": "Provide a mixture of reasoning, summarization, classification, translation and code tasks to emulate a real\u2011world workload and observe how different operations affect energy consumption.",
    "testset_notes": "This set mixes short and long prompts, structured outputs and creative tasks. Use it to test energy consumption under varied workloads. Track tokens per joule and compare models across task types, as recommended by research on tokens/J metrics.",
    "question_id": "ts4_q1",
    "question_difficulty": "mixed",
    "question_task_type": "summarization",
    "expected_answer_description": "Condenses the paragraph to two sentences mentioning AI\u2019s rapid growth and its applications like image recognition, translation and creative tasks.",
    "max_output_tokens_hint": 60,
    "energy_relevance": "Moderate summarization; tests energy usage for condensing information.",
    "tags": [
      "summarization",
      "mixed",
      "medium-output"
    ],
    "wh_per_1k_tokens": 0.040551,
    "energy_kwh_per_token": 4.1e-08,
    "g_co2": 0.001391
  },
  {
    "prompt": "Generate a short paragraph (50\u201370 words) describing a fictional planet with two suns.",
    "completion": "Xylos orbits two suns \u2013 Solara, a vibrant orange giant, and Umbra, a cool, violet dwarf. The planet\u2019s surface is a tapestry of turquoise jungles and crimson deserts, perpetually bathed in shifting, dual-toned light. Gigantic, crystalline trees shimmer with refracted hues, and strange, bioluminescent flora illuminate the twilight hours. Xylos is a world of dramatic contrasts and unique ecosystems, ripe for exploration.",
    "tokens_prompt": 30,
    "tokens_completion": 90,
    "duration_s": 1.585,
    "response_time_s": 1.585,
    "energy_wh_raw": 0.008904,
    "energy_wh_net": 0.008904,
    "provider": "ollama",
    "model": "gemma3:1b",
    "region": "unknown",
    "notice": null,
    "sampling_ms": 100,
    "device_name": "Apple M1 Pro Mac (MacBookPro18,3)",
    "device_type": "apple",
    "os_name": "macOS",
    "os_version": "26.2",
    "cpu_model": "Apple M1 Pro",
    "gpu_model": "Apple M1 Pro",
    "ram_gb": 16.0,
    "chip_architecture": "arm64",
    "testset_id": "ts4",
    "testset_name": "Mixed task suite (realistic workload)",
    "testset_goal": "Provide a mixture of reasoning, summarization, classification, translation and code tasks to emulate a real\u2011world workload and observe how different operations affect energy consumption.",
    "testset_notes": "This set mixes short and long prompts, structured outputs and creative tasks. Use it to test energy consumption under varied workloads. Track tokens per joule and compare models across task types, as recommended by research on tokens/J metrics.",
    "question_id": "ts4_q2",
    "question_difficulty": "mixed",
    "question_task_type": "reasoning",
    "expected_answer_description": "Creates a descriptive paragraph about a made\u2011up planet orbiting two stars, mentioning environmental features such as double shadows, long days or unique ecosystems.",
    "max_output_tokens_hint": 100,
    "energy_relevance": "Creative generation with word\u2011count constraint; longer output increases energy.",
    "tags": [
      "creative-writing",
      "description",
      "long-output"
    ],
    "wh_per_1k_tokens": 0.0742,
    "energy_kwh_per_token": 7.4e-08,
    "g_co2": 0.003116
  },
  {
    "prompt": "Write a JSON object with keys \u2018name\u2019, \u2018age\u2019 and \u2018favorite_color\u2019 representing a fictional character of your choice.",
    "completion": "```json\n{\n  \"name\": \"Elara Vance\",\n  \"age\": 28,\n  \"favorite_color\": \"Forest Green\"\n}\n```\n\nThis JSON object represents a fictional character named Elara Vance.  It has three key-value pairs:\n\n*   **name:** \"Elara Vance\" - The character's name.\n*   **age:** 28 - The character's age.\n*   **favorite_color:** \"Forest Green\" - The character's preferred color.",
    "tokens_prompt": 35,
    "tokens_completion": 115,
    "duration_s": 1.972,
    "response_time_s": 1.972,
    "energy_wh_raw": 0.011641,
    "energy_wh_net": 0.011641,
    "provider": "ollama",
    "model": "gemma3:1b",
    "region": "unknown",
    "notice": null,
    "sampling_ms": 100,
    "device_name": "Apple M1 Pro Mac (MacBookPro18,3)",
    "device_type": "apple",
    "os_name": "macOS",
    "os_version": "26.2",
    "cpu_model": "Apple M1 Pro",
    "gpu_model": "Apple M1 Pro",
    "ram_gb": 16.0,
    "chip_architecture": "arm64",
    "testset_id": "ts4",
    "testset_name": "Mixed task suite (realistic workload)",
    "testset_goal": "Provide a mixture of reasoning, summarization, classification, translation and code tasks to emulate a real\u2011world workload and observe how different operations affect energy consumption.",
    "testset_notes": "This set mixes short and long prompts, structured outputs and creative tasks. Use it to test energy consumption under varied workloads. Track tokens per joule and compare models across task types, as recommended by research on tokens/J metrics.",
    "question_id": "ts4_q3",
    "question_difficulty": "mixed",
    "question_task_type": "coding",
    "expected_answer_description": "Returns a valid JSON object with three key\u2013value pairs, e.g., {\"name\": \"Alex\", \"age\": 28, \"favorite_color\": \"green\"}.",
    "max_output_tokens_hint": 30,
    "energy_relevance": "Structured output generation; tests the model\u2019s ability to follow formatting instructions.",
    "tags": [
      "json",
      "structured-output",
      "short"
    ],
    "wh_per_1k_tokens": 0.077607,
    "energy_kwh_per_token": 7.8e-08,
    "g_co2": 0.004074
  },
  {
    "prompt": "Classify the following items as \u2018fruit\u2019 or \u2018vegetable\u2019: apple, carrot, banana, broccoli, tomato. Return your answer as a list of pairs [item, type].",
    "completion": "Here's the classification of the items as fruit or vegetable:\n\n*   [apple, fruit]\n*   [carrot, vegetable]\n*   [banana, fruit]\n*   [broccoli, vegetable]\n*   [tomato, vegetable]\n\n",
    "tokens_prompt": 46,
    "tokens_completion": 55,
    "duration_s": 1.077,
    "response_time_s": 1.077,
    "energy_wh_raw": 0.005221,
    "energy_wh_net": 0.005221,
    "provider": "ollama",
    "model": "gemma3:1b",
    "region": "unknown",
    "notice": null,
    "sampling_ms": 100,
    "device_name": "Apple M1 Pro Mac (MacBookPro18,3)",
    "device_type": "apple",
    "os_name": "macOS",
    "os_version": "26.2",
    "cpu_model": "Apple M1 Pro",
    "gpu_model": "Apple M1 Pro",
    "ram_gb": 16.0,
    "chip_architecture": "arm64",
    "testset_id": "ts4",
    "testset_name": "Mixed task suite (realistic workload)",
    "testset_goal": "Provide a mixture of reasoning, summarization, classification, translation and code tasks to emulate a real\u2011world workload and observe how different operations affect energy consumption.",
    "testset_notes": "This set mixes short and long prompts, structured outputs and creative tasks. Use it to test energy consumption under varied workloads. Track tokens per joule and compare models across task types, as recommended by research on tokens/J metrics.",
    "question_id": "ts4_q4",
    "question_difficulty": "mixed",
    "question_task_type": "classification",
    "expected_answer_description": "Produces a list of pairs indicating fruit or vegetable classifications, e.g., [[\"apple\", \"fruit\"], \u2026].",
    "max_output_tokens_hint": 60,
    "energy_relevance": "Requires producing a structured list and mapping categories; moderate reasoning and output length.",
    "tags": [
      "classification",
      "list",
      "structured-output"
    ],
    "wh_per_1k_tokens": 0.051693,
    "energy_kwh_per_token": 5.2e-08,
    "g_co2": 0.001827
  },
  {
    "prompt": "Translate this recipe step into Spanish: \u2018Chop the onions finely and saut\u00e9 them in olive oil until golden brown.\u2019",
    "completion": "Here are a few options for translating that recipe step into Spanish, with slightly different nuances:\n\n**Option 1 (Most straightforward):**\n\n\u201cPica finamente las cebollas y c\u00f3rtalas en aceite de oliva hasta que est\u00e9n doradas.\u201d\n\n**Option 2 (More emphasis on the action):**\n\n\u201cPica las cebollas muy finamente y sofr\u00edelas en aceite de oliva hasta que est\u00e9n doradas.\u201d\n\n**Option 3 (Slightly more formal):**\n\n\u201cPica las cebollas con cuidado y sofr\u00edelas en aceite de oliva hasta que est\u00e9n doradas.\u201d (This adds a bit more care to the chopping)\n\n**I recommend Option 1 as the best general translation.**\n\nLet me know if you\u2019d like me to tailor it further!",
    "tokens_prompt": 32,
    "tokens_completion": 167,